{
  "version": "1.0",
  "feature_vector_capacity": 4,
  "feature_vector_length": 2,
  "checksum": "opaque model metadata",
  "features": [
    {
      "symbol": "__global__",
      "indicators": [
        {
          "kind": "day_of_week",
          "source": {
            "type": "every_event"
          }
        }
      ]
    },
    {
      "symbol": "btcusd",
      "indicators": [
        {
          "kind": "sma",
          "source": {
            "type": "field",
            "event": "trade",
            "field": "price"
          },
          "warmup_policy": "full_window",
          "outputs": [
            {
              "window": 5,
              "id": "btc_trade_sma_5"
            }
          ]
        }
      ]
    }
  ]
}
